{
  "schema_version": "1.2.0",
  "type": "confessional_cooperative_curriculum",
  "metadata": {
    "title": "KoKo Beispielcurriculum GYM 7/8 B",
    "country": "DE",
    "state": "BW",
    "school_type": "GYM",
    "grades": [
      7,
      8
    ],
    "variant": "B",
    "cooperation_model": "confessional_cooperative",
    "denominations": [
      "evangelical",
      "catholic"
    ],
    "source": {
      "url": "https://www.kirche-und-religionsunterricht.de/resources/ecics_6245_zua1q15j.docx",
      "format": "docx",
      "sha256": "19917d72e4eff06fdfe74e57d0d83c43885b87303ac0c7fd3873f799d770e814"
    },
    "conversion": {
      "complete": true,
      "method": "OOXML table/paragraph extraction with formatting-aware denomination attribution",
      "unit_count": 7,
      "content_competency_occurrences": 93,
      "process_competency_occurrences": 86
    }
  },
  "education_plan_bindings": [
    {
      "role": "denominational_basis",
      "denomination": "evangelical",
      "subject": "Evangelische Religionslehre",
      "plan_code": "BP2016BW_ALLG_GYM_REV"
    },
    {
      "role": "denominational_basis",
      "denomination": "catholic",
      "subject": "Katholische Religionslehre",
      "plan_code": "BP2016BW_ALLG_GYM_RRK"
    }
  ],
  "units": [
    {
      "id": "ue-01",
      "number": 1,
      "title": "Tu was! – Prophetie",
      "hours": null,
      "preparation_questions": [
        "Was ist Prophetie für mich?",
        "Welche prophetischen Menschen sind für mich vorbildlich?",
        "Gibt es auch falsche Prophetie?",
        "Woran erkenne ich falsche Prophetie?",
        "Welche meiner Schüler*innen engagieren sich prophetisch?",
        "Worauf beruft sich Prophetie?"
      ],
      "shared_plan": [
        {
          "type": "central_content",
          "text": "Umsetzung im Unterricht"
        },
        {
          "type": "central_content",
          "text": "Der prophetische Anspruchan das Handeln der Gläubigen"
        }
      ],
      "denominational_profiles": {
        "evangelical": {
          "content_competencies": [
            {
              "id": "3.2.1.1",
              "number": 1,
              "display": "3.2.1 (1)",
              "denomination": "evangelical",
              "text": "sich mit Fragen nach Identität, Selbstbild, Fremdwahrnehmung und Rollenzuschreibung im sozialen Zusammenleben (zum Beispiel Familie, Peergroup, soziale Netzwerke) auseinandersetzen",
              "levels_mentioned": [],
              "raw": "3.2.1 (1) sich mit Fragen nach Identität, Selbstbild, Fremdwahrnehmung und Rollenzuschreibung im sozialen Zusammenleben (zum Beispiel Familie, Peergroup, soziale Netzwerke) auseinandersetzen",
              "references": [
                {
                  "id": "3.2.1.1",
                  "display": "3.2.1 (1)"
                }
              ]
            },
            {
              "id": "3.2.1.2",
              "number": 2,
              "display": "3.2.1 (2)",
              "denomination": "evangelical",
              "text": "die Bedeutung von Vorbildern und ldolen erklären und auf ihre mögliche Ambivalenz hin untersuchen",
              "levels_mentioned": [],
              "raw": "3.2.1 (2) die Bedeutung von Vorbildern und ldolen erklären und auf ihre mögliche Ambivalenz hin untersuchen",
              "references": [
                {
                  "id": "3.2.1.2",
                  "display": "3.2.1 (2)"
                }
              ]
            },
            {
              "id": "3.2.3.2",
              "number": 2,
              "display": "3.2.3 (2)",
              "denomination": "evangelical",
              "text": "Zusammenhänge zwischen prophetischem Wirken und Gerechtigkeit aufzeigen",
              "levels_mentioned": [
                "G"
              ],
              "raw": "3.2.3 (2) Zusammenhänge zwischen prophetischem Wirken und Gerechtigkeit aufzeigen",
              "references": [
                {
                  "id": "3.2.3.2",
                  "display": "3.2.3 (2)"
                }
              ]
            },
            {
              "id": "3.2.4.3",
              "number": 3,
              "display": "3.2.4 (3)",
              "denomination": "evangelical",
              "text": "an Beispielen Folgen des christlichen Glaubens an Gott (zum Beispiel Franz von Assisi, Luther, Katharina von Bora, Friedrich von Bodelschwingh, Albert Schweitzer, Martin Luther King, Elisabeth von Thadden, Desmond Tutu, Local Heroes) untersuchen",
              "levels_mentioned": [
                "G"
              ],
              "raw": "3.2.4 (3) an Beispielen Folgen des christlichen Glaubens an Gott (zum Beispiel Franz von Assisi, Luther, Katharina von Bora, Friedrich von Bodelschwingh, Albert Schweitzer, Martin Luther King, Elisabeth von Thadden, Desmond Tutu, Local Heroes) untersuchen",
              "references": [
                {
                  "id": "3.2.4.3",
                  "display": "3.2.4 (3)"
                }
              ]
            },
            {
              "id": "3.2.5.2",
              "number": 2,
              "display": "3.2.5 (2)",
              "denomination": "evangelical",
              "text": "Begründungen christlicher Freiheit (zum Beispiel verlorener Sohn, Paulus, Luther) darstellen",
              "levels_mentioned": [],
              "raw": "3.2.5 (2) Begründungen christlicher Freiheit (zum Beispiel verlorener Sohn, Paulus, Luther) darstellen",
              "references": [
                {
                  "id": "3.2.5.2",
                  "display": "3.2.5 (2)"
                }
              ]
            },
            {
              "id": "3.2.6.3",
              "number": 3,
              "display": "3.2.6 (3)",
              "denomination": "evangelical",
              "text": "sich mit einem kirchlichem Handlungsfeld auseinandersetzen (zum Beispiel Telefonseelsorge, Flüchtlingsarbeit, Schwangerschaftsberatung, Suchtberatung, Diakonie in lokalen Kontexten, Jugendarbeit)",
              "levels_mentioned": [],
              "raw": "3.2.6 (3) sich mit einem kirchlichem Handlungsfeld auseinandersetzen (zum Beispiel Telefonseelsorge, Flüchtlingsarbeit, Schwangerschaftsberatung, Suchtberatung, Diakonie in lokalen Kontexten, Jugendarbeit)",
              "references": [
                {
                  "id": "3.2.6.3",
                  "display": "3.2.6 (3)"
                }
              ]
            }
          ],
          "perspective": [
            "inhaltsbezogene Kompetenzen evangelisch",
            "Die Bedeutung von Freiheit und Gerechtigkeit für prophetisches Reden und Handeln"
          ]
        },
        "catholic": {
          "content_competencies": [
            {
              "id": "3.2.1.3",
              "number": 3,
              "display": "3.2.1 (3)",
              "denomination": "catholic",
              "text": "an biblischen Texten erläutern, dass Menschen nach christlicher Auffassung zur Freiheit und Verantwortung gegenüber Gott und den Mitmenschen berufen sind (zum Beispiel Ex 20,2.15.16; Lk 10,25–27)",
              "levels_mentioned": [
                "M"
              ],
              "raw": "3.2.1 (3) an biblischen Texten erläutern, dass Menschen nach christlicher Auffassung zur Freiheit und Verantwortung gegenüber Gott und den Mitmenschen berufen sind (zum Beispiel Ex 20,2.15.16; Lk 10,25–27)",
              "references": [
                {
                  "id": "3.2.1.3",
                  "display": "3.2.1 (3)"
                }
              ]
            },
            {
              "id": "3.2.2.1",
              "number": 1,
              "display": "3.2.2 (1)",
              "denomination": "catholic",
              "text": "an einem regionalen Beispiel entfalten, wie menschliches Handeln Natur und Umwelt schädigen kann und deshalb ethisch zu befragen ist",
              "levels_mentioned": [],
              "raw": "3.2.2 (1) an einem regionalen Beispiel entfalten, wie menschliches Handeln Natur und Umwelt schädigen kann und deshalb ethisch zu befragen ist",
              "references": [
                {
                  "id": "3.2.2.1",
                  "display": "3.2.2 (1)"
                }
              ]
            },
            {
              "id": "3.2.2.2",
              "number": 2,
              "display": "3.2.2 (2)",
              "denomination": "catholic",
              "text": "ein gesellschaftliches Phänomen, welches das Zusammenleben von Menschen gefährdet, als ethische Herausforderung erläutern (zum Beispiel Cybermobbing, Diskriminierung, Extremismus, Arm und Reich)",
              "levels_mentioned": [
                "M"
              ],
              "raw": "3.2.2 (2) ein gesellschaftliches Phänomen, welches das Zusammenleben von Menschen gefährdet, als ethische Herausforderung erläutern (zum Beispiel Cybermobbing, Diskriminierung, Extremismus, Arm und Reich)",
              "references": [
                {
                  "id": "3.2.2.2",
                  "display": "3.2.2 (2)"
                }
              ]
            },
            {
              "id": "3.2.2.3",
              "number": 3,
              "display": "3.2.2 (3)",
              "denomination": "catholic",
              "text": "die Botschaft eines Propheten (zum Beispiel Amos, Micha) unter Berücksichtigung des Dekalogs sachgemäß und aktualisierend erläutern",
              "levels_mentioned": [
                "M"
              ],
              "raw": "3.2.2 (3) die Botschaft eines Propheten (zum Beispiel Amos, Micha) unter Berücksichtigung des Dekalogs sachgemäß und aktualisierend erläutern",
              "references": [
                {
                  "id": "3.2.2.3",
                  "display": "3.2.2 (3)"
                }
              ]
            },
            {
              "id": "3.2.2.4",
              "number": 4,
              "display": "3.2.2 (4)",